<?xml version="1.0" encoding="UTF-8"?>
<!DOCTYPE cv SYSTEM "cv.dtd" [
    <!ENTITY copy "&#169;">
]>
<cv>
    <personal_info>
        <name>コスタ・トラン</name>
        <address>123例通り、75000パリ、フランス</address>
        <phone>+33 1 23 45 67 89</phone>
        <email>costa.tran@hotmail.com</email>
        <website>https://costa-tran.netlify.app/</website>
    </personal_info>
    <profile>
        <summary>
            Sup Galiléeで見習いコンピュータエンジニアとして勉強している学生。
        </summary>
    </profile>
    <experience>
        <job>
            <title>ソフトウェアエンジニア見習い</title>
            <company>Forvia</company>
            <location>パリ、フランス</location>
            <date>2022年9月5日</date>
            <responsibility>Bluetoothスタックのテストツールの開発。</responsibility>
        </job>
    </experience>
    <education>
        <degree>
            <title>コンピュータエンジニアリングの学位</title>
            <institution>Sup Galilée</institution>
            <date>2022-2025</date>
        </degree>
        <degree>
            <title>総合科学バカロレア</title>
            <institution>ラ・サール高校 - サン・ロザリー校</institution>
            <date>2018-2020</date>
        </degree>
    </education>
    <skills>
        <skill>HTML</skill>
        <skill>CSS</skill>
        <skill>JavaScript</skill>
        <skill>C++</skill>
        <skill>XML</skill>
        <skill>JSON</skill>
        <skill>MySQL</skill>
    </skills>
    <languages>
        <language>
            <name>フランス語</name>
            <proficiency>ネイティブ</proficiency>
        </language>
        <language>
            <name>英語</name>
            <proficiency>B1</proficiency>
        </language>
        <language>
            <name>日本語</name>
            <proficiency>初心者</proficiency>
        </language>
    </languages>
    <copyright>&copy; 2024 コスタ・トラン</copyright>
</cv>
