<?xml version="1.0" encoding="UTF-8"?>
<!DOCTYPE cv SYSTEM "cv.dtd" [
    <!ENTITY copy "&#169;">
]>
<cv>
    <personal_info>
        <name>Costa TRAN</name>
        <address>123 Rue Exemple, 75000 Paris, France</address>
        <phone>+33 1 23 45 67 89</phone>
        <email>costa.tran@hotmail.com</email>
        <website>https://costa-tran.netlify.app/</website>
    </personal_info>
    <profile>
        <summary>
            Étudiant à Sup Galilée en tant qu'ingénieur informatique en apprentissage.
        </summary>
    </profile>
    <experience>
        <job>
            <title>Apprenti ingénieur logiciel</title>
            <company>Forvia</company>
            <location>Paris, France</location>
            <date>05/09/2022</date>
            <responsibility>Développement d'un outil de test pour la stack Bluetooth.</responsibility>
        </job>
    </experience>
    <education>
        <degree>
            <title>Diplôme d'Ingénieur Informatique</title>
            <institution>Sup Galilée</institution>
            <date>2022-2025</date>
        </degree>
        <degree>
            <title>Baccalauréat Général Scientifique</title>
            <institution>Lycée La Salle - Saint Rosaire</institution>
            <date>2018 - 2020</date>
        </degree>
    </education>
    <skills>
        <skill>HTML</skill>
        <skill>CSS</skill>
        <skill>JavaScript</skill>
        <skill>C++</skill>
        <skill>XML</skill>
        <skill>JSON</skill>
        <skill>MySQL</skill>
    </skills>
    <languages>
        <language>
            <name>Français</name>
            <proficiency>Natif</proficiency>
        </language>
        <language>
            <name>Anglais</name>
            <proficiency>B1</proficiency>
        </language>
        <language>
            <name>Japonais</name>
            <proficiency>Débutant</proficiency>
        </language>
    </languages>
    <copyright>&copy; 2024 Costa TRAN</copyright>
</cv>